URL,File,Current Description,Current Length,Optimized Description,Optimized Length,Status,Reasoning
/,src\pages\Index.tsx,"Professional cleaning services across South Florida, Las Vegas, Hawaii, Columbus Ohio, and Dallas. Residential, commercial, and vacation rental cleaning.",153,"Professional cleaning services across South Florida, Las Vegas, Hawaii, Columbus Ohio, and Dallas. Residential, commercial, and vacation rental cleaning.",153,✅ Already Optimized,"Current description is within optimal range"
/about,src\pages\about\+Page.tsx,"Learn about Red Rock Cleaning's commitment to providing exceptional cleaning services across multiple locations.",112,"Learn about Red Rock Cleans' commitment to excellence in residential and commercial cleaning across South Florida, Las Vegas, Hawaii, Columbus, and Dallas.",155,✅ Optimized,"About page: Trust-building with locations"
/about-us,src\pages\AboutUs.tsx,"Learn about Red Rock Cleaning's commitment to excellence in residential and commercial cleaning services across multiple locations.",131,"Learn about Red Rock Cleaning's commitment to excellence in residential and commercial cleaning services across multiple locations.",131,✅ Already Optimized,"Current description is within optimal range"
/airbnb-cleaning,src\pages\AirbnbCleaning.tsx,"Professional Airbnb and vacation rental cleaning services. Fast turnovers, consistent quality, and guest-ready results every time.",130,"Professional Airbnb and vacation rental cleaning services. Fast turnovers, consistent quality, and guest-ready results every time.",130,✅ Already Optimized,"Current description is within optimal range"
/blog,src\pages\Blog.tsx,"Expert cleaning tips, advice, and guides from Red Rock Cleaning professionals. Learn how to maintain a cleaner, healthier home.",127,"Expert cleaning tips, advice, and guides from Red Rock Cleaning professionals. Learn how to maintain a cleaner, healthier home.",127,✅ Already Optimized,"Current description is within optimal range"
/blog/cleaning-tips/6-handy-tips-to-help-you-minimize-your-time-on-housework,src\pages\blog\cleaning-tips\6-handy-tips-to-help-you-minimize-your-time-on-housework\+Page.tsx,"Tired of endless chores? Discover 6 handy tips to help you minimize your time on housework and reclaim your free time.",118,"Tired of endless chores? Discover 6 handy tips to minimize your time on housework and reclaim your free time. Read our time-saving cleaning guide!",146,✅ Optimized,"Blog post: Benefit-focused with natural CTA"
/blog/cleaning-tips/airbnb-bedding-management-you-should-know,src\pages\blog\cleaning-tips\airbnb-bedding-management-you-should-know\+Page.tsx,"Master Airbnb bedding management with expert tips on selecting, maintaining, and rotating linens for 5-star guest reviews and efficient turnover operations.",156,"Master Airbnb bedding management with expert tips on selecting, maintaining, and rotating linens for 5-star guest reviews and efficient turnover operations.",156,✅ Already Optimized,"Current description is within optimal range"
/blog/cleaning-tips/carpet-cleaning-to-remove-flea-infestation,src\pages\blog\cleaning-tips\carpet-cleaning-to-remove-flea-infestation\+Page.tsx,"Dealing with a flea infestation? Our step-by-step guide shows you how professional carpet cleaning can help eradicate fleas from your home for good.",148,"Dealing with a flea infestation? Our step-by-step guide shows you how professional carpet cleaning can help eradicate fleas from your home for good.",148,✅ Already Optimized,"Current description is within optimal range"
/blog/cleaning-tips/grill-maintenance-101-the-ultimate-guide-to-cleaning-your-outdoor-grill,src\pages\blog\cleaning-tips\grill-maintenance-101-the-ultimate-guide-to-cleaning-your-outdoor-grill\+Page.tsx,"Master grill maintenance with our ultimate guide. Learn how to clean your outdoor grill for better taste, longer life, and a healthier cooking experience.",154,"Master grill maintenance with our ultimate guide. Learn how to clean your outdoor grill for better taste, longer life, and a healthier cooking experience.",154,✅ Already Optimized,"Current description is within optimal range"
/blog/cleaning-tips/health-code-violations,src\pages\blog\cleaning-tips\health-code-violations\+Page.tsx,"Learn how to avoid and address health code violations in your business. Discover the role of professional commercial cleaning in maintaining compliance.",152,"Learn how to avoid and address health code violations in your business. Discover the role of professional commercial cleaning in maintaining compliance.",152,✅ Already Optimized,"Current description is within optimal range"
/blog/cleaning-tips/natures-air-purifiers-the-best-plants-for-cleaner-indoor-air,src\pages\blog\cleaning-tips\natures-air-purifiers-the-best-plants-for-cleaner-indoor-air\+Page.tsx,"Discover the best houseplants for naturally purifying your indoor air. Our guide covers top plants, care tips, and how cleaning complements their benefits.",155,"Discover the best houseplants for naturally purifying your indoor air. Our guide covers top plants, care tips, and how cleaning complements their benefits.",155,✅ Already Optimized,"Current description is within optimal range"
/blog/cleaning-tips/step-by-step-guide-effective-techniques-for-removing-ink-stains-from-carpets,src\pages\blog\cleaning-tips\step-by-step-guide-effective-techniques-for-removing-ink-stains-from-carpets\+Page.tsx,"Don't panic over ink stains! Follow our step-by-step guide to effectively remove ink from carpets and learn when to call the professionals for stubborn spots.",158,"Don't panic over ink stains! Follow our step-by-step guide to effectively remove ink from carpets and learn when to call the professionals for stubborn spots.",158,✅ Already Optimized,"Current description is within optimal range"
/blog/cleaning-tips/the-science-of-spring-cleaning,src\pages\blog\cleaning-tips\the-science-of-spring-cleaning\+Page.tsx,"Discover the science of spring cleaning! Learn how decluttering and a deep clean can improve your mood, health, and focus. Get our ultimate checklist.",150,"Discover the science of spring cleaning! Learn how decluttering and a deep clean can improve your mood, health, and focus. Get our ultimate checklist.",150,✅ Already Optimized,"Current description is within optimal range"
/blog/cleaning-tips/why-you-should-host-a-spring-cleaning-party,src\pages\blog\cleaning-tips\why-you-should-host-a-spring-cleaning-party\+Page.tsx,"Turn spring cleaning into a fun event! Learn why you should host a spring cleaning party and how to plan one, plus when to call in the pros for tough jobs.",155,"Turn spring cleaning into a fun event! Learn why you should host a spring cleaning party and how to plan one, plus when to call in the pros for tough jobs.",155,✅ Already Optimized,"Current description is within optimal range"
/blog/cleaning-tips/your-essential-guide-to-the-ultimate-move-out-cleaning-checklist,src\pages\blog\cleaning-tips\your-essential-guide-to-the-ultimate-move-out-cleaning-checklist\+Page.tsx,"Our ultimate move-out cleaning checklist ensures you get your security deposit back. Follow our room-by-room guide for a perfect clean, or hire our pros to do it for you.",170,"Get your security deposit back with our ultimate move-out cleaning checklist. Room-by-room guide for perfect results. Free PDF download!",136,✅ Optimized,"Blog post: Problem-solution with value add"
/book-now-columbus-ohio,src\pages\locations\ColumbusBooking.tsx,"Book your professional cleaning service in Columbus Ohio. Easy online booking for house and office cleaning.",108,"Book professional cleaning in Columbus Ohio instantly. Easy online scheduling for home, office, and Airbnb cleaning. Get your free quote now!",141,✅ Optimized,"Booking page: Convenience-focused with CTA"
/book-now-dallas,src\pages\locations\DallasBooking.tsx,"Book your professional cleaning service in Dallas. Easy online booking for residential and commercial cleaning.",111,"Book professional cleaning in Dallas instantly. Easy online scheduling for home, office, and Airbnb cleaning. Get your free quote now!",134,✅ Optimized,"Booking page: Convenience-focused with CTA"
/book-now-las-vegas,src\pages\locations\LasVegasBooking.tsx,"Book your professional cleaning service in Las Vegas. Easy online booking for residential and commercial cleaning.",114,"Book professional cleaning in Las Vegas instantly. Easy online scheduling for home, office, and Airbnb cleaning. Get your free quote now!",137,✅ Optimized,"Booking page: Convenience-focused with CTA"
/book-now-maui,src\pages\locations\MauiBooking.tsx,"Book your professional cleaning service in Maui. Easy online booking for vacation rental and deep cleaning services.",116,"Book professional cleaning in Maui instantly. Easy online scheduling for home, office, and Airbnb cleaning. Get your free quote now!",132,✅ Optimized,"Booking page: Convenience-focused with CTA"
/book-now-oahu,src\pages\locations\OahuBooking.tsx,"Book your professional cleaning service in Oahu and Honolulu. Easy online booking for residential and vacation rental cleaning.",127,"Book your professional cleaning service in Oahu and Honolulu. Easy online booking for residential and vacation rental cleaning.",127,✅ Already Optimized,"Current description is within optimal range"
/book-now-south-florida,src\pages\locations\SouthFloridaBooking.tsx,"Book your professional cleaning service in South Florida. Easy online booking for residential and vacation rental cleaning.",123,"Book your professional cleaning service in South Florida. Easy online booking for residential and vacation rental cleaning.",123,✅ Already Optimized,"Current description is within optimal range"
/church-cleaning,src\pages\church-cleaning\+Page.tsx,"Professional church cleaning services by Red Rock Cleans. We provide respectful, detailed cleaning for sanctuaries, fellowship halls, and all places of worship. Learn more.",172,"Professional church cleaning services by Red Rock Cleans. Trusted experts delivering exceptional results across all locations. Get your free quote today!",153,✅ Optimized,"General service page: Service-specific benefits with CTA"
/cleaning-supplies,src\pages\CleaningSupplies.tsx,"Complete list of cleaning supplies and equipment needed to work as a Red Rock Cleans contractor. Tools, equipment, and cleaning products checklist.",147,"Complete list of cleaning supplies and equipment needed to work as a Red Rock Cleans contractor. Tools, equipment, and cleaning products checklist.",147,✅ Already Optimized,"Current description is within optimal range"
/columbus-ohio,src\pages\locations\ColumbusHome.tsx,"Professional house and office cleaning in Columbus Ohio. Reliable service with easy online booking. Experience quality you can trust.",133,"Professional house and office cleaning in Columbus Ohio. Reliable service with easy online booking. Experience quality you can trust.",133,✅ Already Optimized,"Current description is within optimal range"
/columbus-ohio-calculator,src\pages\locations\ColumbusCalculator.tsx,"Calculate your cleaning service cost instantly. Get an accurate quote for house and office cleaning in Columbus Ohio.",117,"Get an instant cleaning quote for Columbus Ohio. Calculate costs for house, office, and vacation rental cleaning. Free estimate in seconds!",139,✅ Optimized,"Calculator page: Speed and value proposition"
/columbus-ohio/airbnb-cleaning-services,src\pages\columbus-ohio\airbnb-cleaning-services\+Page.tsx,"Get 5-star reviews with our reliable Airbnb cleaning service in Columbus, OH. Red Rock Cleans offers automated turnover cleaning for vacation rentals in Dublin, the Short North, and beyond.",189,"Earn 5-star guest reviews with Red Rock Cleans' Airbnb cleaning in Columbus & Dublin. Professional fast turnover service. Book automated turnover cleaning!",155,✅ Optimized,"Location + Service: Benefit-driven with location and CTA"
/columbus-ohio/church-cleaning,src\pages\columbus-ohio\church-cleaning\+Page.tsx,"Professional church cleaning services in Columbus, OH. Red Rock Cleans provides respectful, detailed cleaning for places of worship in Dublin, Upper Arlington, and across the area.",180,"Keep your place of worship pristine with Red Rock Cleans' church cleaning in Columbus & Dublin. Professional respectful, detailed service.",138,✅ Optimized,"Location + Service: Benefit-driven with location and CTA"
/columbus-ohio/data-center-cleaning,src\pages\columbus-ohio\data-center-cleaning\+Page.tsx,"Specialized data center cleaning in Columbus, OH. Red Rock Cleans offers ISO 14644-1 compliant server room, sub-floor, and critical environment cleaning in Dublin and New Albany to ensure uptime.",195,"Protect your critical infrastructure with Red Rock Cleans' data center cleaning in Columbus & Dublin. Professional ISO-compliant cleanroom service.",147,✅ Optimized,"Location + Service: Benefit-driven with location and CTA"
/columbus-ohio/deep-cleaning-services,src\pages\columbus-ohio\deep-cleaning-services\+Page.tsx,"Restore your home's sparkle with our thorough deep cleaning service in Columbus, OH. We tackle built-up grime for a truly refreshed home in Dublin, Upper Arlington, and beyond.",176,"Get a truly deep clean with Red Rock Cleans' deep cleaning in Columbus & Dublin. Professional top-to-bottom scrubbing. Book your deep clean today!",146,✅ Optimized,"Location + Service: Benefit-driven with location and CTA"
/columbus-ohio/factory-cleaning,src\pages\columbus-ohio\factory-cleaning\+Page.tsx,"Professional factory cleaning in Columbus, OH. Red Rock Cleans offers heavy-duty cleaning for manufacturing plants in Dublin, Westerville, and beyond to ensure safety and productivity.",184,"Keep your facility safe & productive with Red Rock Cleans' factory cleaning in Columbus & Dublin. Professional heavy-duty industrial service.",141,✅ Optimized,"Location + Service: Benefit-driven with location and CTA"
/columbus-ohio/government-facility-cleaning,src\pages\columbus-ohio\government-facility-cleaning\+Page.tsx,"Secure and compliant government facility cleaning in Columbus, OH. Red Rock Cleans provides discreet, professional cleaning for municipal and federal buildings by security-cleared staff.",186,"Maintain secure facilities with Red Rock Cleans' government cleaning in Columbus & Dublin. Professional security-cleared staff. Schedule a consultation!",152,✅ Optimized,"Location + Service: Benefit-driven with location and CTA"
/columbus-ohio/gym-cleaning,src\pages\columbus-ohio\gym-cleaning\+Page.tsx,"Professional gym cleaning in Columbus, OH. Red Rock Cleans provides hygienic fitness center sanitation, including equipment disinfection, in Dublin, Upper Arlington, and beyond.",177,"Keep members healthy & happy with Red Rock Cleans' gym cleaning in Columbus & Dublin. Professional equipment disinfection. Boost member retention!",146,✅ Optimized,"Location + Service: Benefit-driven with location and CTA"
/columbus-ohio/industrial-cleaning,src\pages\columbus-ohio\industrial-cleaning\+Page.tsx,"Heavy-duty industrial cleaning services in Columbus, OH. Red Rock Cleans provides OSHA compliant cleaning for manufacturing plants and facilities in Dublin, Westerville, and beyond.",181,"Maintain OSHA compliance with Red Rock Cleans' industrial cleaning in Columbus & Dublin. Professional heavy-duty solutions. Schedule your service!",146,✅ Optimized,"Location + Service: Benefit-driven with location and CTA"
/columbus-ohio/medical-office-cleaning,src\pages\columbus-ohio\medical-office-cleaning\+Page.tsx,"Specialized medical office cleaning in Columbus, OH. Red Rock Cleans provides HIPAA and OSHA compliant cleaning for clinics and healthcare facilities in Dublin, Upper Arlington, and beyond.",189,"Ensure patient safety with Red Rock Cleans' medical office cleaning in Columbus & Dublin. Professional HIPAA-compliant service. Protect your patients!",150,✅ Optimized,"Location + Service: Benefit-driven with location and CTA"
/columbus-ohio/move-out-cleaning-services,src\pages\columbus-ohio\move-out-cleaning-services\+Page.tsx,"Secure your deposit with our reliable move out cleaning service in Columbus, OH. We provide thorough end-of-tenancy cleaning in Dublin, Upper Arlington, and beyond. Book today!",176,"Get your deposit back with Red Rock Cleans' move-out cleaning in Columbus & Dublin. Professional end-of-lease perfection. Secure your full deposit!",147,✅ Optimized,"Location + Service: Benefit-driven with location and CTA"
/columbus-ohio/post-construction-cleaning-services,src\pages\columbus-ohio\post-construction-cleaning-services\+Page.tsx,"Professional post construction cleaning in Columbus, OH. Red Rock Cleans handles construction cleanup for new builds and renovations in Dublin, Upper Arlington, and beyond. Get a detailed quote!",194,"Make your space move-in ready with Red Rock Cleans' post-construction cleaning in Columbus & Dublin. Professional dust & debris removal. Get your free quote!",157,✅ Optimized,"Location + Service: Benefit-driven with location and CTA"
/columbus-ohio/restaurant-cleaning,src\pages\columbus-ohio\restaurant-cleaning\+Page.tsx,"Professional restaurant cleaning in Columbus, OH. Red Rock Cleans helps you pass health inspections and earn 5-star reviews with comprehensive kitchen and dining room cleaning.",176,"Pass health inspections with Red Rock Cleans' restaurant cleaning in Columbus & Dublin. Professional kitchen & dining sanitation. Earn 5-star reviews!",150,✅ Optimized,"Location + Service: Benefit-driven with location and CTA"
/columbus-ohio/retail-cleaning,src\pages\columbus-ohio\retail-cleaning\+Page.tsx,"Professional retail store cleaning in Columbus, OH. Red Rock Cleans helps enhance your brand image with spotless storefronts and sales floors in Dublin, the Short North, and beyond.",181,"Impress every customer with Red Rock Cleans' retail cleaning in Columbus & Dublin. Professional spotless storefronts. Enhance your brand!",137,✅ Optimized,"Location + Service: Benefit-driven with location and CTA"
/columbus-ohio/salon-spa-cleaning,src\pages\columbus-ohio\salon-spa-cleaning\+Page.tsx,"Professional salon and spa cleaning in Columbus, OH. Red Rock Cleans ensures a pristine, hygienic, and relaxing environment for hair salons, day spas, and medispas in Dublin and the Short North.",194,"Create a relaxing atmosphere with Red Rock Cleans' salon & spa cleaning in Columbus & Dublin. Professional pristine, hygienic service. Delight your clients!",156,✅ Optimized,"Location + Service: Benefit-driven with location and CTA"
/columbus-ohio/school-cleaning,src\pages\columbus-ohio\school-cleaning\+Page.tsx,"Professional school cleaning services in Columbus, OH. Red Rock Cleans provides a safe and healthy learning environment for students in Dublin, Upper Arlington, and beyond.",172,"Provide a healthy learning environment with Red Rock Cleans' school cleaning in Columbus & Dublin. Professional safe for students. Protect your students!",153,✅ Optimized,"Location + Service: Benefit-driven with location and CTA"
/columbus-ohio/showroom-cleaning,src\pages\columbus-ohio\showroom-cleaning\+Page.tsx,"Professional showroom cleaning in Columbus, OH. Red Rock Cleans enhances your product presentation with meticulous cleaning for car dealerships and luxury retail in Dublin and New Albany.",187,"Showcase products perfectly with Red Rock Cleans' showroom cleaning in Columbus & Dublin. Professional meticulous presentation. Impress every visitor!",150,✅ Optimized,"Location + Service: Benefit-driven with location and CTA"
/columbus-ohio/standard-cleaning-services,src\pages\columbus-ohio\standard-cleaning-services\+Page.tsx,"Keep your Columbus home consistently beautiful with our reliable standard cleaning service. We offer flexible maid services in Dublin, Upper Arlington, and beyond. Get your free quote!",184,"Maintain a spotless home with Red Rock Cleans' standard cleaning in Columbus & Dublin. Professional regular maintenance. Schedule your recurring service!",153,✅ Optimized,"Location + Service: Benefit-driven with location and CTA"
/columbus-ohio/warehouse-cleaning,src\pages\columbus-ohio\warehouse-cleaning\+Page.tsx,"Professional warehouse cleaning in Columbus, OH. Red Rock Cleans improves safety and efficiency with comprehensive floor scrubbing, high-bay dusting, and more for logistics centers.",181,"Improve safety & efficiency with Red Rock Cleans' warehouse cleaning in Columbus & Dublin. Professional floor-to-ceiling service. Get your free estimate!",153,✅ Optimized,"Location + Service: Benefit-driven with location and CTA"
/commercial-cleaning,src\pages\CommercialCleaning.tsx,"Professional commercial cleaning services for offices, retail spaces, and businesses. Maintain a pristine workplace environment.",128,"Professional commercial cleaning services for offices, retail spaces, and businesses. Maintain a pristine workplace environment.",128,✅ Already Optimized,"Current description is within optimal range"
/commercial-cleaning-cost-estimator,src\pages\commercial-cleaning-cost-estimator\index.page.tsx,"Get a free ballpark estimate for your commercial cleaning needs. Budget confidently using industry averages, then refine with your location.",140,"Get a free ballpark estimate for your commercial cleaning needs. Budget confidently using industry averages, then refine with your location.",140,✅ Already Optimized,"Current description is within optimal range"
/commercial-cleaning-estimator,src\pages\CommercialCleaningEstimator.tsx,"Calculate your commercial cleaning costs instantly. Get accurate pricing for office, retail, and business cleaning services across all our locations.",149,"Calculate your commercial cleaning costs instantly. Get accurate pricing for office, retail, and business cleaning services across all our locations.",149,✅ Already Optimized,"Current description is within optimal range"
/commercial-cleaning-time-estimator,src\pages\commercial-cleaning-time-estimator\index.page.tsx,"Use our free tool to estimate how long professional commercial cleaning will take based on ISSA standards. Get an instant time estimate to plan your budget.",156,"Use our free tool to estimate how long professional commercial cleaning will take based on ISSA standards. Get an instant time estimate to plan your budget.",156,✅ Already Optimized,"Current description is within optimal range"
/commercial-quote,src\pages\commercial-quote\index.page.tsx,"❌ MISSING",0,"Professional cleaning services by Red Rock Cleans. Trusted experts serving South Florida, Las Vegas, Hawaii, Columbus, and Dallas. Book online today!",149,✅ Optimized,"Fallback: Keep existing or use generic optimized"
/contact,src\pages\contact\+Page.tsx,"Get in touch with Red Rock Cleaning for professional cleaning services. Contact us today for a free quote.",106,"Contact Red Rock Cleans for professional cleaning in South Florida, Las Vegas, Hawaii, Columbus, and Dallas. Call, email, or book online. Free quotes!",150,✅ Optimized,"Contact page: Multi-channel with locations"
/contact,src\pages\contact\+Page.tsx,"Get in touch with Red Rock Cleaning. Contact information for all our locations including phone numbers and email addresses.",123,"Get in touch with Red Rock Cleaning. Contact information for all our locations including phone numbers and email addresses.",123,✅ Already Optimized,"Current description is within optimal range"
/dallas,src\pages\locations\DallasHome.tsx,"Premium residential and commercial cleaning packages in Dallas. Professional, reliable cleaning services you can trust.",119,"Premium house cleaning in Dallas & Plano by Red Rock Cleans. Residential, commercial, and vacation rental services. Book online today!",134,✅ Optimized,"Location home: City-specific with service types and CTA"
/dallas-calculator,src\pages\locations\DallasCalculator.tsx,"Calculate your cleaning service cost instantly. Get an accurate quote for house and commercial cleaning in Dallas.",114,"Get an instant cleaning quote for Dallas. Calculate costs for house, office, and vacation rental cleaning. Free estimate in seconds!",132,✅ Optimized,"Calculator page: Speed and value proposition"
/dallas/airbnb-cleaning-services,src\pages\dallas\airbnb-cleaning-services\+Page.tsx,"Get 5-star reviews with our reliable Airbnb cleaning service in Dallas. Red Rock Cleans offers automated turnover cleaning for vacation rentals in Uptown, Plano, and beyond.",173,"Earn 5-star guest reviews with Red Rock Cleans' Airbnb cleaning in Dallas & Plano. Professional fast turnover service. Book automated turnover cleaning!",152,✅ Optimized,"Location + Service: Benefit-driven with location and CTA"
/dallas/church-cleaning,src\pages\dallas\church-cleaning\+Page.tsx,"Professional church cleaning services in Dallas. Red Rock Cleans provides respectful, detailed cleaning for places of worship in Plano, Frisco, and across the Dallas area.",171,"Keep your place of worship pristine with Red Rock Cleans' church cleaning in Dallas & Plano. Professional respectful, detailed service.",135,✅ Optimized,"Location + Service: Benefit-driven with location and CTA"
/dallas/data-center-cleaning,src\pages\dallas\data-center-cleaning\+Page.tsx,"Specialized data center cleaning in Dallas. Red Rock Cleans offers ISO 14644-1 compliant server room, sub-floor, and critical environment cleaning in Plano and Frisco to ensure uptime.",184,"Protect your critical infrastructure with Red Rock Cleans' data center cleaning in Dallas & Plano. Professional ISO-compliant cleanroom service.",144,✅ Optimized,"Location + Service: Benefit-driven with location and CTA"
