URL,File,Current Description,Current Length,Optimized Description,Optimized Length,Status,Reasoning
/dallas/deep-cleaning-services,src\pages\dallas\deep-cleaning-services\+Page.tsx,"Restore your home's sparkle with our thorough deep cleaning service in Dallas. We tackle built-up grime for a truly refreshed home in Plano, Frisco, and beyond. Get your free quote!",181,"Get a truly deep clean with Red Rock Cleans' deep cleaning in Dallas & Plano. Professional top-to-bottom scrubbing. Book your deep clean today!",143,✅ Optimized,"Location + Service: Benefit-driven with location and CTA"
/dallas/factory-cleaning,src\pages\dallas\factory-cleaning\+Page.tsx,"Heavy-duty factory cleaning in Dallas. Red Rock Cleans offers comprehensive cleaning for manufacturing plants in Plano, Frisco, and across the Dallas area to ensure safety and productivity.",189,"Keep your facility safe & productive with Red Rock Cleans' factory cleaning in Dallas & Plano. Professional heavy-duty industrial service. Get a custom quote!",158,✅ Optimized,"Location + Service: Benefit-driven with location and CTA"
/dallas/government-facility-cleaning,src\pages\dallas\government-facility-cleaning\+Page.tsx,"Secure and compliant government facility cleaning in Dallas. Red Rock Cleans provides discreet, professional cleaning for municipal and federal buildings in Plano and Frisco by security-cleared staff.",200,"Maintain secure facilities with Red Rock Cleans' government cleaning in Dallas & Plano. Professional security-cleared staff. Schedule a consultation!",149,✅ Optimized,"Location + Service: Benefit-driven with location and CTA"
/dallas/gym-cleaning,src\pages\dallas\gym-cleaning\+Page.tsx,"Professional gym cleaning in Dallas. Red Rock Cleans provides hygienic fitness center and health club sanitation, including equipment disinfection and locker room cleaning in Plano and Frisco.",192,"Keep members healthy & happy with Red Rock Cleans' gym cleaning in Dallas & Plano. Professional equipment disinfection. Boost member retention!",143,✅ Optimized,"Location + Service: Benefit-driven with location and CTA"
/dallas/industrial-cleaning,src\pages\dallas\industrial-cleaning\+Page.tsx,"Heavy-duty industrial cleaning services in Dallas. Red Rock Cleans provides OSHA compliant cleaning for manufacturing plants, equipment, and industrial facilities to ensure safety and uptime.",191,"Maintain OSHA compliance with Red Rock Cleans' industrial cleaning in Dallas & Plano. Professional heavy-duty solutions. Schedule your service!",143,✅ Optimized,"Location + Service: Benefit-driven with location and CTA"
/dallas/medical-office-cleaning,src\pages\dallas\medical-office-cleaning\+Page.tsx,"Specialized medical office cleaning in Dallas. Red Rock Cleans provides HIPAA and OSHA compliant cleaning for clinics and healthcare facilities in Plano, Frisco, and beyond.",173,"Ensure patient safety with Red Rock Cleans' medical office cleaning in Dallas & Plano. Professional HIPAA-compliant service. Protect your patients!",147,✅ Optimized,"Location + Service: Benefit-driven with location and CTA"
/dallas/move-out-cleaning-services,src\pages\dallas\move-out-cleaning-services\+Page.tsx,"Secure your deposit with our reliable move out cleaning service in Dallas. We provide thorough end-of-tenancy cleaning in Plano, Frisco, and beyond. Book today!",160,"Get your deposit back with Red Rock Cleans' move-out cleaning in Dallas & Plano. Professional end-of-lease perfection. Secure your full deposit!",144,✅ Optimized,"Location + Service: Benefit-driven with location and CTA"
/dallas/post-construction-cleaning-services,src\pages\dallas\post-construction-cleaning-services\+Page.tsx,"Professional post construction cleaning service in Dallas. Red Rock Cleans handles construction cleanup for new builds and renovations in Plano, Frisco, and beyond. Get a detailed quote today!",192,"Make your space move-in ready with Red Rock Cleans' post-construction cleaning in Dallas & Plano. Professional dust & debris removal. Get your free quote!",154,✅ Optimized,"Location + Service: Benefit-driven with location and CTA"
/dallas/restaurant-cleaning,src\pages\dallas\restaurant-cleaning\+Page.tsx,"Professional restaurant cleaning in Dallas. Red Rock Cleans helps you pass health inspections and earn 5-star reviews with comprehensive kitchen and dining room cleaning.",170,"Pass health inspections with Red Rock Cleans' restaurant cleaning in Dallas & Plano. Professional kitchen & dining sanitation. Earn 5-star reviews!",147,✅ Optimized,"Location + Service: Benefit-driven with location and CTA"
/dallas/retail-cleaning,src\pages\dallas\retail-cleaning\+Page.tsx,"Professional retail store cleaning in Dallas. Red Rock Cleans helps enhance your brand image and customer experience with spotless storefronts and sales floors in Plano, Frisco, and beyond.",189,"Impress every customer with Red Rock Cleans' retail cleaning in Dallas & Plano. Professional spotless storefronts. Enhance your brand!",134,✅ Optimized,"Location + Service: Benefit-driven with location and CTA"
/dallas/salon-spa-cleaning,src\pages\dallas\salon-spa-cleaning\+Page.tsx,"Professional salon and spa cleaning in Dallas. Red Rock Cleans ensures a pristine, hygienic, and relaxing environment for hair salons, day spas, and medispas in Plano, Frisco, and beyond.",187,"Create a relaxing atmosphere with Red Rock Cleans' salon & spa cleaning in Dallas & Plano. Professional pristine, hygienic service. Delight your clients!",153,✅ Optimized,"Location + Service: Benefit-driven with location and CTA"
/dallas/school-cleaning,src\pages\dallas\school-cleaning\+Page.tsx,"Professional school cleaning services in Dallas. Red Rock Cleans provides a safe and healthy learning environment for students in Plano, Frisco, and across the Dallas area.",172,"Provide a healthy learning environment with Red Rock Cleans' school cleaning in Dallas & Plano. Professional safe for students. Protect your students!",150,✅ Optimized,"Location + Service: Benefit-driven with location and CTA"
/dallas/showroom-cleaning,src\pages\dallas\showroom-cleaning\+Page.tsx,"Professional showroom cleaning in Dallas. Red Rock Cleans enhances your product presentation with meticulous cleaning for car dealerships, furniture stores, and more in Plano and Frisco.",186,"Showcase products perfectly with Red Rock Cleans' showroom cleaning in Dallas & Plano. Professional meticulous presentation. Impress every visitor!",147,✅ Optimized,"Location + Service: Benefit-driven with location and CTA"
/dallas/standard-cleaning-services,src\pages\dallas\standard-cleaning-services\+Page.tsx,"Keep your Dallas home consistently beautiful with our reliable standard cleaning service. We offer flexible maid services in Plano, Frisco, and beyond. Get your free quote!",172,"Maintain a spotless home with Red Rock Cleans' standard cleaning in Dallas & Plano. Professional regular maintenance. Schedule your recurring service!",150,✅ Optimized,"Location + Service: Benefit-driven with location and CTA"
/dallas/warehouse-cleaning,src\pages\dallas\warehouse-cleaning\+Page.tsx,"Professional warehouse cleaning in Dallas. Red Rock Cleans improves safety and efficiency with comprehensive floor scrubbing, high-bay dusting, and more for logistics centers in Plano and Frisco.",195,"Improve safety & efficiency with Red Rock Cleans' warehouse cleaning in Dallas & Plano. Professional floor-to-ceiling service. Get your free estimate!",150,✅ Optimized,"Location + Service: Benefit-driven with location and CTA"
/data-center-cleaning,src\pages\data-center-cleaning\+Page.tsx,"Specialized data center cleaning services. Red Rock Cleans provides professional server room, sub-floor, and critical environment cleaning to prevent downtime. Learn more.",171,"Professional data center cleaning services by Red Rock Cleans. Trusted experts delivering exceptional results across all locations. Get your free quote today!",158,✅ Optimized,"General service page: Service-specific benefits with CTA"
/deep-cleaning,src\pages\DeepCleaning.tsx,"Comprehensive deep cleaning services that reach every corner. Perfect for seasonal cleaning, move-in/out, or thorough home sanitization.",136,"Comprehensive deep cleaning services that reach every corner. Perfect for seasonal cleaning, move-in/out, or thorough home sanitization.",136,✅ Already Optimized,"Current description is within optimal range"
/deep-cleaning-services,src\pages\deep-cleaning-services\+Page.tsx,"Comprehensive deep cleaning services for your home. Thorough cleaning that reaches every corner and surface.",108,"Get a truly deep clean from Red Rock Cleans. Top-to-bottom scrubbing tackles built-up grime for maximum freshness. Book your deep clean today!",142,✅ Optimized,"General service page: Service-specific benefits with CTA"
/f-a-q,src\pages\FAQ.tsx,"Find answers to common questions about our cleaning services, pricing, scheduling, and more.",92,"Find answers to common questions about our cleaning services, pricing, scheduling, and more. Get your free quote today!",119,⚠️ Needs Review,"Fallback: Keep existing or use generic optimized"
/factory-cleaning,src\pages\factory-cleaning\+Page.tsx,"Professional factory cleaning services. Red Rock Cleans provides heavy-duty cleaning for manufacturing plants to ensure safety, compliance, and productivity. Learn more.",169,"Professional factory cleaning services by Red Rock Cleans. Trusted experts delivering exceptional results across all locations. Get your free quote today!",154,✅ Optimized,"General service page: Service-specific benefits with CTA"
/general-retail-cleaning,src\pages\general-retail-cleaning\+Page.tsx,"Professional retail store cleaning services. Red Rock Cleans helps enhance your brand image and customer experience with spotless storefronts, sales floors, and more.",166,"Professional general retail cleaning services by Red Rock Cleans. Trusted experts delivering exceptional results across all locations.",134,✅ Optimized,"General service page: Service-specific benefits with CTA"
/government-facility-cleaning,src\pages\government-facility-cleaning\+Page.tsx,"Secure and compliant government facility cleaning. Red Rock Cleans provides discreet, professional cleaning for municipal, federal, and public buildings by security-cleared staff.",179,"Professional government facility cleaning services by Red Rock Cleans. Trusted experts delivering exceptional results across all locations.",139,✅ Optimized,"General service page: Service-specific benefits with CTA"
/gym-cleaning,src\pages\gym-cleaning\+Page.tsx,"Professional gym and fitness center cleaning services. Sanitize equipment, locker rooms, and common areas with our specialized cleaning protocols.",146,"Professional gym and fitness center cleaning services. Sanitize equipment, locker rooms, and common areas with our specialized cleaning protocols.",146,✅ Already Optimized,"Current description is within optimal range"
/hiring-application-new,src\pages\HiringApplicationNew.tsx,"Apply to join the Red Rock Cleans team. Complete our work application form to start your career in professional cleaning services.",130,"Apply to join the Red Rock Cleans team. Complete our work application form to start your career in professional cleaning services.",130,✅ Already Optimized,"Current description is within optimal range"
/hiring-requirements,src\pages\HiringRequirements.tsx,"Explore career opportunities at Red Rock Cleaning. Learn about our hiring requirements and join our professional cleaning team.",127,"Explore career opportunities at Red Rock Cleaning. Learn about our hiring requirements and join our professional cleaning team.",127,✅ Already Optimized,"Current description is within optimal range"
/index,src\pages\index\+Page.tsx,"Professional cleaning services across South Florida, Las Vegas, Hawaii, Columbus Ohio, and Dallas. Residential, commercial, and vacation rental cleaning.",153,"Professional cleaning services across South Florida, Las Vegas, Hawaii, Columbus Ohio, and Dallas. Residential, commercial, and vacation rental cleaning.",153,✅ Already Optimized,"Current description is within optimal range"
/industrial-cleaning,src\pages\industrial-cleaning\+Page.tsx,"Heavy-duty industrial cleaning services for factories, plants, and warehouses. OSHA-compliant cleaning to protect workers, equipment, and uptime.",145,"Heavy-duty industrial cleaning services for factories, plants, and warehouses. OSHA-compliant cleaning to protect workers, equipment, and uptime.",145,✅ Already Optimized,"Current description is within optimal range"
/las-vegas,src\pages\locations\LasVegasHome.tsx,"Professional residential and commercial cleaning services in Las Vegas and Henderson. Reliable, quality cleaning you can trust.",127,"Professional residential and commercial cleaning services in Las Vegas and Henderson. Reliable, quality cleaning you can trust.",127,✅ Already Optimized,"Current description is within optimal range"
/las-vegas-calculator,src\pages\locations\LasVegasCalculator.tsx,"Calculate your cleaning service cost instantly. Get an accurate quote for house and office cleaning in Las Vegas.",113,"Get an instant cleaning quote for Las Vegas. Calculate costs for house, office, and vacation rental cleaning. Free estimate in seconds!",135,✅ Optimized,"Calculator page: Speed and value proposition"
/las-vegas/airbnb-cleaning-services,src\pages\las-vegas\airbnb-cleaning-services\+Page.tsx,"5-star Airbnb cleaning services in Las Vegas. Red Rock Cleans offers reliable, automated turnover cleaning for vacation rentals to impress every guest. Get your free instant quote today!",186,"Earn 5-star guest reviews with Red Rock Cleans' Airbnb cleaning in Las Vegas & Henderson. Professional fast turnover service.",125,✅ Optimized,"Location + Service: Benefit-driven with location and CTA"
/las-vegas/church-cleaning,src\pages\las-vegas\church-cleaning\+Page.tsx,"Professional church cleaning services in Las Vegas. Red Rock Cleans provides respectful, detailed cleaning for places of worship in Henderson, Summerlin, and across the valley.",176,"Keep your place of worship pristine with Red Rock Cleans' church cleaning in Las Vegas & Henderson. Professional respectful, detailed service.",142,✅ Optimized,"Location + Service: Benefit-driven with location and CTA"
/las-vegas/data-center-cleaning,src\pages\las-vegas\data-center-cleaning\+Page.tsx,"Specialized data center cleaning in Las Vegas. Red Rock Cleans offers ISO 14644-1 compliant server room, sub-floor, and critical environment cleaning to ensure uptime.",167,"Protect your critical infrastructure with Red Rock Cleans' data center cleaning in Las Vegas & Henderson. Professional ISO-compliant cleanroom service.",151,✅ Optimized,"Location + Service: Benefit-driven with location and CTA"
/las-vegas/deep-cleaning-services,src\pages\las-vegas\deep-cleaning-services\+Page.tsx,"Restore your home's sparkle with our thorough deep cleaning service in Las Vegas. Red Rock Cleans tackles built-up grime for a truly refreshed home. Get your free quote!",169,"Get a truly deep clean with Red Rock Cleans' deep cleaning in Las Vegas & Henderson. Professional top-to-bottom scrubbing. Book your deep clean today!",150,✅ Optimized,"Location + Service: Benefit-driven with location and CTA"
/las-vegas/factory-cleaning,src\pages\las-vegas\factory-cleaning\+Page.tsx,"Professional factory cleaning in Las Vegas. Red Rock Cleans offers heavy-duty cleaning for manufacturing plants in Henderson, North Las Vegas, and beyond to ensure safety and productivity.",188,"Keep your facility safe & productive with Red Rock Cleans' factory cleaning in Las Vegas & Henderson. Professional heavy-duty industrial service.",145,✅ Optimized,"Location + Service: Benefit-driven with location and CTA"
/las-vegas/government-facility-cleaning,src\pages\las-vegas\government-facility-cleaning\+Page.tsx,"Secure and compliant government facility cleaning in Las Vegas. Red Rock Cleans provides discreet, professional cleaning for municipal and federal buildings by security-cleared staff.",183,"Maintain secure facilities with Red Rock Cleans' government cleaning in Las Vegas & Henderson. Professional security-cleared staff. Schedule a consultation!",156,✅ Optimized,"Location + Service: Benefit-driven with location and CTA"
/las-vegas/gym-cleaning,src\pages\las-vegas\gym-cleaning\+Page.tsx,"Professional gym cleaning in Las Vegas. Red Rock Cleans provides hygienic fitness center and health club sanitation, including equipment disinfection and locker room cleaning in Henderson and Summerlin.",202,"Keep members healthy & happy with Red Rock Cleans' gym cleaning in Las Vegas & Henderson. Professional equipment disinfection. Boost member retention!",150,✅ Optimized,"Location + Service: Benefit-driven with location and CTA"
/las-vegas/industrial-cleaning,src\pages\las-vegas\industrial-cleaning\+Page.tsx,"Heavy-duty industrial cleaning services in Las Vegas. Red Rock Cleans provides OSHA compliant cleaning for manufacturing plants, equipment, and industrial facilities to ensure safety and uptime.",194,"Maintain OSHA compliance with Red Rock Cleans' industrial cleaning in Las Vegas & Henderson. Professional heavy-duty solutions. Schedule your service!",150,✅ Optimized,"Location + Service: Benefit-driven with location and CTA"
/las-vegas/medical-office-cleaning,src\pages\las-vegas\medical-office-cleaning\+Page.tsx,"Specialized medical office cleaning in Las Vegas. Red Rock Cleans provides HIPAA and OSHA compliant cleaning for clinics and healthcare facilities in Henderson, Summerlin, and beyond.",183,"Ensure patient safety with Red Rock Cleans' medical office cleaning in Las Vegas & Henderson. Professional HIPAA-compliant service. Protect your patients!",154,✅ Optimized,"Location + Service: Benefit-driven with location and CTA"
/las-vegas/move-out-cleaning-services,src\pages\las-vegas\move-out-cleaning-services\+Page.tsx,"Secure your deposit with our reliable move out cleaning service in Las Vegas. Red Rock Cleans provides thorough end-of-tenancy cleaning for renters and sellers. Book today!",172,"Get your deposit back with Red Rock Cleans' move-out cleaning in Las Vegas & Henderson. Professional end-of-lease perfection. Secure your full deposit!",151,✅ Optimized,"Location + Service: Benefit-driven with location and CTA"
/las-vegas/post-construction-cleaning-services,src\pages\las-vegas\post-construction-cleaning-services\+Page.tsx,"Professional post construction cleaning service in Las Vegas. Red Rock Cleans handles all construction cleanup for new builds and renovations. Get your free, detailed quote today!",179,"Make your space move-in ready with Red Rock Cleans' post-construction cleaning in Las Vegas & Henderson. Professional dust & debris removal.",140,✅ Optimized,"Location + Service: Benefit-driven with location and CTA"
/las-vegas/restaurant-cleaning,src\pages\las-vegas\restaurant-cleaning\+Page.tsx,"Professional restaurant cleaning in Las Vegas. Red Rock Cleans helps you pass health inspections and earn 5-star reviews with comprehensive kitchen and dining room cleaning.",173,"Pass health inspections with Red Rock Cleans' restaurant cleaning in Las Vegas & Henderson. Professional kitchen & dining sanitation. Earn 5-star reviews!",154,✅ Optimized,"Location + Service: Benefit-driven with location and CTA"
/las-vegas/retail-cleaning,src\pages\las-vegas\retail-cleaning\+Page.tsx,"Professional retail store cleaning in Las Vegas. Red Rock Cleans helps enhance your brand image and customer experience with spotless storefronts, sales floors, and more.",170,"Impress every customer with Red Rock Cleans' retail cleaning in Las Vegas & Henderson. Professional spotless storefronts. Enhance your brand!",141,✅ Optimized,"Location + Service: Benefit-driven with location and CTA"
/las-vegas/salon-spa-cleaning,src\pages\las-vegas\salon-spa-cleaning\+Page.tsx,"❌ MISSING",0,"Create a relaxing atmosphere with Red Rock Cleans' salon & spa cleaning in Las Vegas & Henderson. Professional pristine, hygienic service.",138,✅ Optimized,"Location + Service: Benefit-driven with location and CTA"
/las-vegas/school-cleaning,src\pages\las-vegas\school-cleaning\+Page.tsx,"Professional school cleaning services in Las Vegas. Red Rock Cleans provides a safe and healthy learning environment for students in Henderson, Summerlin, and across Clark County.",179,"Provide a healthy learning environment with Red Rock Cleans' school cleaning in Las Vegas & Henderson. Professional safe for students. Protect your students!",157,✅ Optimized,"Location + Service: Benefit-driven with location and CTA"
/las-vegas/showroom-cleaning,src\pages\las-vegas\showroom-cleaning\+Page.tsx,"Professional showroom cleaning in Las Vegas. Impeccable floors, glass, and product presentation for dealerships and retail showrooms.",133,"Professional showroom cleaning in Las Vegas. Impeccable floors, glass, and product presentation for dealerships and retail showrooms.",133,✅ Already Optimized,"Current description is within optimal range"
/las-vegas/standard-cleaning-services,src\pages\las-vegas\standard-cleaning-services\+Page.tsx,"Keep your Las Vegas home consistently beautiful with our reliable standard cleaning service. Red Rock Cleans offers flexible maid services for a spotless home. Get your free quote!",180,"Maintain a spotless home with Red Rock Cleans' standard cleaning in Las Vegas & Henderson. Professional regular maintenance. Schedule your recurring service!",157,✅ Optimized,"Location + Service: Benefit-driven with location and CTA"
/las-vegas/warehouse-cleaning,src\pages\las-vegas\warehouse-cleaning\+Page.tsx,"❌ MISSING",0,"Improve safety & efficiency with Red Rock Cleans' warehouse cleaning in Las Vegas & Henderson. Professional floor-to-ceiling service. Get your free estimate!",157,✅ Optimized,"Location + Service: Benefit-driven with location and CTA"
/maidily-app,src\pages\MaidilyApp.tsx,"Learn how to use the Maidily mobile app for managing schedules, tracking jobs, and streamlining your work at Red Rock Cleaning.",127,"Learn how to use the Maidily mobile app for managing schedules, tracking jobs, and streamlining your work at Red Rock Cleaning.",127,✅ Already Optimized,"Current description is within optimal range"
/maui,src\pages\locations\MauiHome.tsx,"Professional vacation rental, deep, and recurring cleaning services in Maui. Premium cleaning for your Hawaiian paradise.",121,"Professional vacation rental, deep, and recurring cleaning services in Maui. Premium cleaning for your Hawaiian paradise.",121,✅ Already Optimized,"Current description is within optimal range"
/maui-calculator,src\pages\locations\MauiCalculator.tsx,"Calculate your cleaning service cost instantly. Get an accurate quote for house and vacation rental cleaning in Maui.",117,"Get an instant cleaning quote for Maui. Calculate costs for house, office, and vacation rental cleaning. Free estimate in seconds!",130,✅ Optimized,"Calculator page: Speed and value proposition"
/maui/airbnb-cleaning-services,src\pages\maui\airbnb-cleaning-services\+Page.tsx,"Get 5-star reviews with our reliable Airbnb cleaning service on Maui. Red Rock Cleans offers automated turnover cleaning for vacation rentals in Wailea, Lahaina, and beyond.",173,"Earn 5-star guest reviews with Red Rock Cleans' Airbnb cleaning in Wailea & Lahaina. Professional fast turnover service. Book automated turnover cleaning!",154,✅ Optimized,"Location + Service: Benefit-driven with location and CTA"
/maui/church-cleaning,src\pages\maui\church-cleaning\+Page.tsx,"Professional church cleaning services on Maui. Red Rock Cleans provides respectful, detailed cleaning for places of worship in Wailea, Lahaina, and across the island.",166,"Keep your place of worship pristine with Red Rock Cleans' church cleaning in Wailea & Lahaina. Professional respectful, detailed service.",137,✅ Optimized,"Location + Service: Benefit-driven with location and CTA"
/maui/data-center-cleaning,src\pages\maui\data-center-cleaning\+Page.tsx,"Specialized data center cleaning on Maui. Red Rock Cleans offers ISO 14644-1 compliant server room, sub-floor, and critical environment cleaning to ensure uptime.",162,"Protect your critical infrastructure with Red Rock Cleans' data center cleaning in Wailea & Lahaina. Professional ISO-compliant cleanroom service.",146,✅ Optimized,"Location + Service: Benefit-driven with location and CTA"
/maui/deep-cleaning-services,src\pages\maui\deep-cleaning-services\+Page.tsx,"Restore your home's sparkle with our thorough deep cleaning service on Maui. Red Rock Cleans tackles built-up grime for a truly refreshed home in Wailea, Lahaina, and beyond. Get your free quote!",195,"Get a truly deep clean with Red Rock Cleans' deep cleaning in Wailea & Lahaina. Professional top-to-bottom scrubbing. Book your deep clean today!",145,✅ Optimized,"Location + Service: Benefit-driven with location and CTA"
/maui/factory-cleaning,src\pages\maui\factory-cleaning\+Page.tsx,"Professional factory cleaning on Maui. Red Rock Cleans offers heavy-duty cleaning for manufacturing plants in Lahaina, Kihei, and beyond to ensure safety and productivity.",171,"Keep your facility safe & productive with Red Rock Cleans' factory cleaning in Wailea & Lahaina. Professional heavy-duty industrial service.",140,✅ Optimized,"Location + Service: Benefit-driven with location and CTA"
/maui/government-facility-cleaning,src\pages\maui\government-facility-cleaning\+Page.tsx,"Secure and compliant government facility cleaning on Maui. Red Rock Cleans provides discreet, professional cleaning for municipal and federal buildings by security-cleared staff.",178,"Maintain secure facilities with Red Rock Cleans' government cleaning in Wailea & Lahaina. Professional security-cleared staff. Schedule a consultation!",151,✅ Optimized,"Location + Service: Benefit-driven with location and CTA"
