URL,File,Current Description,Current Length,Optimized Description,Optimized Length,Status,Reasoning
/south-florida/move-out-cleaning-services,src\pages\south-florida\move-out-cleaning-services\+Page.tsx,"Secure your deposit with our reliable move out cleaning service in South Florida. Red Rock Cleans provides thorough end-of-tenancy cleaning for renters and sellers in Fort Lauderdale, Weston, and beyond. Book today!",215,"Get your deposit back with Red Rock Cleans' move-out cleaning in Fort Lauderdale & Weston. Professional end-of-lease perfection. Secure your full deposit!",154,✅ Optimized,"Location + Service: Benefit-driven with location and CTA"
/south-florida/post-construction-cleaning-services,src\pages\south-florida\post-construction-cleaning-services\+Page.tsx,"Professional post construction cleaning service in South Florida. Red Rock Cleans handles construction cleanup for new builds and renovations in Fort Lauderdale, Weston, and beyond. Get a quote!",194,"Make your space move-in ready with Red Rock Cleans' post-construction cleaning in Fort Lauderdale & Weston. Professional dust & debris removal.",143,✅ Optimized,"Location + Service: Benefit-driven with location and CTA"
/south-florida/restaurant-cleaning,src\pages\south-florida\restaurant-cleaning\+Page.tsx,"Professional restaurant cleaning in South Florida. Red Rock Cleans helps you pass health inspections and earn 5-star reviews with comprehensive kitchen and dining room cleaning.",177,"Pass health inspections with Red Rock Cleans' restaurant cleaning in Fort Lauderdale & Weston. Professional kitchen & dining sanitation. Earn 5-star reviews!",157,✅ Optimized,"Location + Service: Benefit-driven with location and CTA"
/south-florida/retail-cleaning,src\pages\south-florida\retail-cleaning\+Page.tsx,"Professional retail store cleaning in South Florida. Red Rock Cleans helps enhance your brand image with spotless storefronts and sales floors in Fort Lauderdale, Weston, and beyond.",182,"Impress every customer with Red Rock Cleans' retail cleaning in Fort Lauderdale & Weston. Professional spotless storefronts. Enhance your brand!",144,✅ Optimized,"Location + Service: Benefit-driven with location and CTA"
/south-florida/salon-spa-cleaning,src\pages\south-florida\salon-spa-cleaning\+Page.tsx,"Professional salon and spa cleaning in South Florida. Red Rock Cleans ensures a pristine, hygienic, and relaxing environment for hair salons, day spas, and medispas in Fort Lauderdale and Weston.",195,"Create a relaxing atmosphere with Red Rock Cleans' salon & spa cleaning in Fort Lauderdale & Weston. Professional pristine, hygienic service.",141,✅ Optimized,"Location + Service: Benefit-driven with location and CTA"
/south-florida/school-cleaning,src\pages\south-florida\school-cleaning\+Page.tsx,"Professional school cleaning services in South Florida. Red Rock Cleans provides a safe and healthy learning environment for students in Fort Lauderdale, Weston, and across Broward County.",188,"Provide a healthy learning environment with Red Rock Cleans' school cleaning in Fort Lauderdale & Weston. Professional safe for students.",137,✅ Optimized,"Location + Service: Benefit-driven with location and CTA"
/south-florida/showroom-cleaning,src\pages\south-florida\showroom-cleaning\+Page.tsx,"Professional showroom cleaning in South Florida. Red Rock Cleans enhances your product presentation with meticulous cleaning for car dealerships and luxury retail in Fort Lauderdale and Weston.",193,"Showcase products perfectly with Red Rock Cleans' showroom cleaning in Fort Lauderdale & Weston. Professional meticulous presentation. Impress every visitor!",157,✅ Optimized,"Location + Service: Benefit-driven with location and CTA"
/south-florida/standard-cleaning-services,src\pages\south-florida\standard-cleaning-services\+Page.tsx,"Keep your home consistently beautiful with our reliable standard cleaning service in South Florida. We offer flexible maid services in Fort Lauderdale, Weston, and beyond. Get your free quote!",192,"Maintain a spotless home with Red Rock Cleans' standard cleaning in Fort Lauderdale & Weston. Professional regular maintenance.",127,✅ Optimized,"Location + Service: Benefit-driven with location and CTA"
/south-florida/warehouse-cleaning,src\pages\south-florida\warehouse-cleaning\+Page.tsx,"Professional warehouse cleaning in South Florida. Red Rock Cleans improves safety and efficiency with comprehensive floor scrubbing, high-bay dusting, and more for logistics centers in Fort Lauderdale.",201,"Improve safety & efficiency with Red Rock Cleans' warehouse cleaning in Fort Lauderdale & Weston. Professional floor-to-ceiling service.",136,✅ Optimized,"Location + Service: Benefit-driven with location and CTA"
/standard-cleaning,src\pages\StandardCleaning.tsx,"Servicios de limpieza estándar regular para mantener un hogar u oficina impecable. Limpiadores profesionales para un mantenimiento constante y confiable.",153,"Servicios de limpieza estándar regular para mantener un hogar u oficina impecable. Limpiadores profesionales para un mantenimiento constante y confiable.",153,✅ Already Optimized,"Current description is within optimal range"
/standard-cleaning-services,src\pages\standard-cleaning-services\+Page.tsx,"Professional standard cleaning services for your home. Regular maintenance cleaning to keep your space spotless.",112,"Keep your home spotless with Red Rock Cleans' standard cleaning service. Regular maintenance for consistent freshness. Schedule your recurring service!",151,✅ Optimized,"General service page: Service-specific benefits with CTA"
/standard-vs-deep,src\pages\StandardVsDeep.tsx,"Understand the differences between standard and deep cleaning services to choose the right option for your home or business.",124,"Understand the differences between standard and deep cleaning services to choose the right option for your home or business.",124,✅ Already Optimized,"Current description is within optimal range"
/sub-contractor-agreement,src\pages\SubContractorAgreement.tsx,"Complete your sub-contractor agreement with Red Rock Cleans. Review terms and sign the agreement to join our team.",114,"Join the Red Rock Cleans team! Learn about requirements, benefits, and how to apply as a professional cleaning contractor. Start your application today!",152,✅ Optimized,"Hiring: Recruitment focused"
/terms-and-conditions,src\pages\TermsAndConditions.tsx,"Review the terms and conditions for using the services provided by Red Rock Cleans. Please read these terms carefully before using our website or booking our services.",167,"Review Red Rock Cleans' terms and conditions. Important information about using our website and booking our professional cleaning services.",139,✅ Optimized,"Terms: Legal clarity"
/warehouse-cleaning,src\pages\warehouse-cleaning\+Page.tsx,"Professional warehouse cleaning services. Red Rock Cleans improves safety and efficiency with comprehensive floor scrubbing, high-bay dusting, and more for logistics centers.",174,"Professional warehouse cleaning services by Red Rock Cleans. Trusted experts delivering exceptional results across all locations. Get your free quote today!",156,✅ Optimized,"General service page: Service-specific benefits with CTA"