URL,File,Current Description,Current Length,Optimized Description,Optimized Length,Status,Reasoning
/maui/gym-cleaning,src\pages\maui\gym-cleaning\+Page.tsx,"Professional gym cleaning on Maui. Red Rock Cleans provides hygienic fitness center and health club sanitation, including equipment disinfection and locker room cleaning in Kihei and Lahaina.",191,"Keep members healthy & happy with Red Rock Cleans' gym cleaning in Wailea & Lahaina. Professional equipment disinfection. Boost member retention!",145,✅ Optimized,"Location + Service: Benefit-driven with location and CTA"
/maui/industrial-cleaning,src\pages\maui\industrial-cleaning\+Page.tsx,"Heavy-duty industrial cleaning services on Maui. Red Rock Cleans provides OSHA compliant cleaning for manufacturing plants, equipment, and industrial facilities to ensure safety and uptime.",189,"Maintain OSHA compliance with Red Rock Cleans' industrial cleaning in Wailea & Lahaina. Professional heavy-duty solutions. Schedule your service!",145,✅ Optimized,"Location + Service: Benefit-driven with location and CTA"
/maui/medical-office-cleaning,src\pages\maui\medical-office-cleaning\+Page.tsx,"Specialized medical office cleaning on Maui. Red Rock Cleans provides HIPAA and OSHA compliant cleaning for clinics and healthcare facilities in Wailea, Lahaina, and beyond.",173,"Ensure patient safety with Red Rock Cleans' medical office cleaning in Wailea & Lahaina. Professional HIPAA-compliant service. Protect your patients!",149,✅ Optimized,"Location + Service: Benefit-driven with location and CTA"
/maui/move-out-cleaning-services,src\pages\maui\move-out-cleaning-services\+Page.tsx,"Secure your deposit with our reliable move out cleaning service on Maui. We provide thorough end-of-tenancy cleaning in Wailea, Lahaina, and beyond. Book today!",160,"Get your deposit back with Red Rock Cleans' move-out cleaning in Wailea & Lahaina. Professional end-of-lease perfection. Secure your full deposit!",146,✅ Optimized,"Location + Service: Benefit-driven with location and CTA"
/maui/post-construction-cleaning-services,src\pages\maui\post-construction-cleaning-services\+Page.tsx,"Professional post construction cleaning on Maui. Red Rock Cleans handles all construction cleanup for new builds and renovations in Wailea, Lahaina, and beyond. Get a detailed quote today!",188,"Make your space move-in ready with Red Rock Cleans' post-construction cleaning in Wailea & Lahaina. Professional dust & debris removal. Get your free quote!",156,✅ Optimized,"Location + Service: Benefit-driven with location and CTA"
/maui/restaurant-cleaning,src\pages\maui\restaurant-cleaning\+Page.tsx,"Professional restaurant cleaning on Maui. Red Rock Cleans helps you pass health inspections and earn 5-star reviews with comprehensive kitchen and dining room cleaning in Lahaina and Kihei.",189,"Pass health inspections with Red Rock Cleans' restaurant cleaning in Wailea & Lahaina. Professional kitchen & dining sanitation. Earn 5-star reviews!",149,✅ Optimized,"Location + Service: Benefit-driven with location and CTA"
/maui/retail-cleaning,src\pages\maui\retail-cleaning\+Page.tsx,"Professional retail store cleaning on Maui. Red Rock Cleans helps enhance your brand image and customer experience with spotless storefronts and sales floors in Wailea, Lahaina, and beyond.",189,"Impress every customer with Red Rock Cleans' retail cleaning in Wailea & Lahaina. Professional spotless storefronts. Enhance your brand!",136,✅ Optimized,"Location + Service: Benefit-driven with location and CTA"
/maui/salon-spa-cleaning,src\pages\maui\salon-spa-cleaning\+Page.tsx,"Professional salon and spa cleaning on Maui. Red Rock Cleans ensures a pristine, hygienic, and relaxing environment for hair salons, day spas, and medispas in Wailea, Lahaina, and beyond.",187,"Create a relaxing atmosphere with Red Rock Cleans' salon & spa cleaning in Wailea & Lahaina. Professional pristine, hygienic service. Delight your clients!",155,✅ Optimized,"Location + Service: Benefit-driven with location and CTA"
/maui/school-cleaning,src\pages\maui\school-cleaning\+Page.tsx,"Professional school cleaning services on Maui. Red Rock Cleans provides a safe and healthy learning environment for students in Kihei, Lahaina, and across the island.",166,"Provide a healthy learning environment with Red Rock Cleans' school cleaning in Wailea & Lahaina. Professional safe for students. Protect your students!",152,✅ Optimized,"Location + Service: Benefit-driven with location and CTA"
/maui/showroom-cleaning,src\pages\maui\showroom-cleaning\+Page.tsx,"Professional showroom cleaning on Maui. Red Rock Cleans enhances your product presentation with meticulous cleaning for car dealerships, furniture stores, and more in Wailea and Lahaina.",186,"Showcase products perfectly with Red Rock Cleans' showroom cleaning in Wailea & Lahaina. Professional meticulous presentation. Impress every visitor!",149,✅ Optimized,"Location + Service: Benefit-driven with location and CTA"
/maui/standard-cleaning-services,src\pages\maui\standard-cleaning-services\+Page.tsx,"Keep your Maui home consistently beautiful with our reliable standard cleaning service. We offer flexible maid services in Wailea, Kihei, and beyond. Get your free quote!",170,"Maintain a spotless home with Red Rock Cleans' standard cleaning in Wailea & Lahaina. Professional regular maintenance. Schedule your recurring service!",152,✅ Optimized,"Location + Service: Benefit-driven with location and CTA"
/maui/warehouse-cleaning,src\pages\maui\warehouse-cleaning\+Page.tsx,"Professional warehouse cleaning on Maui. Red Rock Cleans improves safety and efficiency with comprehensive floor scrubbing, high-bay dusting, and more for logistics centers.",173,"Improve safety & efficiency with Red Rock Cleans' warehouse cleaning in Wailea & Lahaina. Professional floor-to-ceiling service. Get your free estimate!",152,✅ Optimized,"Location + Service: Benefit-driven with location and CTA"
/medical-office-cleaning,src\pages\medical-office-cleaning\+Page.tsx,"Specialized medical office cleaning services. Red Rock Cleans provides HIPAA and OSHA compliant cleaning for clinics and healthcare facilities to ensure patient safety. Learn more.",180,"Professional medical office cleaning services by Red Rock Cleans. Trusted experts delivering exceptional results across all locations.",134,✅ Optimized,"General service page: Service-specific benefits with CTA"
/move-out-cleaning,src\pages\MoveOutCleaning.tsx,"Professional move out cleaning services. Get your security deposit back with our thorough move-out cleaning. Available in South Florida, Las Vegas, Hawaii, Columbus Ohio, and Dallas.",182,"Get your full security deposit back with Red Rock Cleans' move-out cleaning. Thorough end-of-lease cleaning guaranteed. Book your move-out clean!",145,✅ Optimized,"General service page: Service-specific benefits with CTA"
/not-found,src\pages\NotFound.tsx,"❌ MISSING",0,"Professional cleaning services by Red Rock Cleans. Trusted experts serving South Florida, Las Vegas, Hawaii, Columbus, and Dallas. Book online today!",149,✅ Optimized,"Fallback: Keep existing or use generic optimized"
/oahu,src\pages\locations\OahuHome.tsx,"Professional residential and vacation rental cleaning services in Oahu and Honolulu. Experience premium Hawaiian cleaning services.",131,"Professional residential and vacation rental cleaning services in Oahu and Honolulu. Experience premium Hawaiian cleaning services.",131,✅ Already Optimized,"Current description is within optimal range"
/oahu-calculator,src\pages\locations\OahuCalculator.tsx,"Calculate your cleaning service cost instantly. Get an accurate quote for house cleaning in Oahu and Honolulu.",110,"Get an instant cleaning quote for Oahu. Calculate costs for house, office, and vacation rental cleaning. Free estimate in seconds!",130,✅ Optimized,"Calculator page: Speed and value proposition"
/oahu/airbnb-cleaning-services,src\pages\oahu\airbnb-cleaning-services\+Page.tsx,"Get 5-star reviews with our reliable Airbnb cleaning service on Oahu. Red Rock Cleans offers automated turnover cleaning for vacation rentals in Honolulu, Waikiki, and beyond.",175,"Earn 5-star guest reviews with Red Rock Cleans' Airbnb cleaning in Honolulu & Waikiki. Professional fast turnover service. Book automated turnover cleaning!",156,✅ Optimized,"Location + Service: Benefit-driven with location and CTA"
/oahu/church-cleaning,src\pages\oahu\church-cleaning\+Page.tsx,"Professional church cleaning services on Oahu. Red Rock Cleans provides respectful, detailed cleaning for places of worship in Honolulu, Kailua, and across the island.",167,"Keep your place of worship pristine with Red Rock Cleans' church cleaning in Honolulu & Waikiki. Professional respectful, detailed service.",139,✅ Optimized,"Location + Service: Benefit-driven with location and CTA"
/oahu/data-center-cleaning,src\pages\oahu\data-center-cleaning\+Page.tsx,"Specialized data center cleaning on Oahu. Red Rock Cleans offers ISO 14644-1 compliant server room, sub-floor, and critical environment cleaning in Honolulu and across the island to ensure uptime.",196,"Protect your critical infrastructure with Red Rock Cleans' data center cleaning in Honolulu & Waikiki. Professional ISO-compliant cleanroom service.",148,✅ Optimized,"Location + Service: Benefit-driven with location and CTA"
/oahu/deep-cleaning-services,src\pages\oahu\deep-cleaning-services\+Page.tsx,"Restore your home's sparkle with our thorough deep cleaning service on Oahu. Red Rock Cleans tackles built-up grime for a truly refreshed home in Honolulu and beyond. Get your free quote!",187,"Get a truly deep clean with Red Rock Cleans' deep cleaning in Honolulu & Waikiki. Professional top-to-bottom scrubbing. Book your deep clean today!",147,✅ Optimized,"Location + Service: Benefit-driven with location and CTA"
/oahu/factory-cleaning,src\pages\oahu\factory-cleaning\+Page.tsx,"Professional factory cleaning on Oahu. Red Rock Cleans offers heavy-duty cleaning for manufacturing plants in Honolulu, Kapolei, and beyond to ensure safety and productivity.",174,"Keep your facility safe & productive with Red Rock Cleans' factory cleaning in Honolulu & Waikiki. Professional heavy-duty industrial service.",142,✅ Optimized,"Location + Service: Benefit-driven with location and CTA"
/oahu/government-facility-cleaning,src\pages\oahu\government-facility-cleaning\+Page.tsx,"Secure and compliant government facility cleaning on Oahu. Red Rock Cleans provides discreet, professional cleaning for municipal and federal buildings in Honolulu and across the island by security-cleared staff.",212,"Maintain secure facilities with Red Rock Cleans' government cleaning in Honolulu & Waikiki. Professional security-cleared staff. Schedule a consultation!",153,✅ Optimized,"Location + Service: Benefit-driven with location and CTA"
/oahu/gym-cleaning,src\pages\oahu\gym-cleaning\+Page.tsx,"Professional gym cleaning on Oahu. Red Rock Cleans provides hygienic fitness center and health club sanitation, including equipment disinfection and locker room cleaning in Honolulu and Kailua.",193,"Keep members healthy & happy with Red Rock Cleans' gym cleaning in Honolulu & Waikiki. Professional equipment disinfection. Boost member retention!",147,✅ Optimized,"Location + Service: Benefit-driven with location and CTA"
/oahu/industrial-cleaning,src\pages\oahu\industrial-cleaning\+Page.tsx,"Heavy-duty industrial cleaning services on Oahu. Red Rock Cleans provides OSHA compliant cleaning for manufacturing plants, equipment, and industrial facilities in Honolulu and Kapolei.",185,"Maintain OSHA compliance with Red Rock Cleans' industrial cleaning in Honolulu & Waikiki. Professional heavy-duty solutions. Schedule your service!",147,✅ Optimized,"Location + Service: Benefit-driven with location and CTA"
/oahu/medical-office-cleaning,src\pages\oahu\medical-office-cleaning\+Page.tsx,"Specialized medical office cleaning on Oahu. Red Rock Cleans provides HIPAA and OSHA compliant cleaning for clinics and healthcare facilities in Honolulu, Kailua, and beyond.",174,"Ensure patient safety with Red Rock Cleans' medical office cleaning in Honolulu & Waikiki. Professional HIPAA-compliant service. Protect your patients!",151,✅ Optimized,"Location + Service: Benefit-driven with location and CTA"
/oahu/move-out-cleaning-services,src\pages\oahu\move-out-cleaning-services\+Page.tsx,"Secure your deposit with our reliable move out cleaning service on Oahu. Red Rock Cleans provides thorough end-of-tenancy cleaning for renters and sellers in Honolulu and beyond. Book today!",190,"Get your deposit back with Red Rock Cleans' move-out cleaning in Honolulu & Waikiki. Professional end-of-lease perfection. Secure your full deposit!",148,✅ Optimized,"Location + Service: Benefit-driven with location and CTA"
/oahu/post-construction-cleaning-services,src\pages\oahu\post-construction-cleaning-services\+Page.tsx,"Professional post construction cleaning on Oahu. Red Rock Cleans handles all construction cleanup for new builds and renovations in Honolulu and beyond. Get a detailed quote today!",180,"Make your space move-in ready with Red Rock Cleans' post-construction cleaning in Honolulu & Waikiki. Professional dust & debris removal. Get your free quote!",158,✅ Optimized,"Location + Service: Benefit-driven with location and CTA"
/oahu/restaurant-cleaning,src\pages\oahu\restaurant-cleaning\+Page.tsx,"Professional restaurant cleaning on Oahu. Red Rock Cleans helps you pass health inspections and earn 5-star reviews with comprehensive kitchen and dining room cleaning in Honolulu and Waikiki.",192,"Pass health inspections with Red Rock Cleans' restaurant cleaning in Honolulu & Waikiki. Professional kitchen & dining sanitation. Earn 5-star reviews!",151,✅ Optimized,"Location + Service: Benefit-driven with location and CTA"
/oahu/retail-cleaning,src\pages\oahu\retail-cleaning\+Page.tsx,"Professional retail store cleaning on Oahu. Red Rock Cleans helps enhance your brand image and customer experience with spotless storefronts and sales floors in Honolulu, Waikiki, and beyond.",191,"Impress every customer with Red Rock Cleans' retail cleaning in Honolulu & Waikiki. Professional spotless storefronts. Enhance your brand!",138,✅ Optimized,"Location + Service: Benefit-driven with location and CTA"
/oahu/salon-spa-cleaning,src\pages\oahu\salon-spa-cleaning\+Page.tsx,"Professional salon and spa cleaning on Oahu. Red Rock Cleans ensures a pristine, hygienic, and relaxing environment for hair salons, day spas, and medispas in Honolulu and Waikiki.",180,"Create a relaxing atmosphere with Red Rock Cleans' salon & spa cleaning in Honolulu & Waikiki. Professional pristine, hygienic service. Delight your clients!",157,✅ Optimized,"Location + Service: Benefit-driven with location and CTA"
/oahu/school-cleaning,src\pages\oahu\school-cleaning\+Page.tsx,"Professional school cleaning services on Oahu. Red Rock Cleans provides a safe and healthy learning environment for students in Honolulu, Kailua, and across the island.",168,"Provide a healthy learning environment with Red Rock Cleans' school cleaning in Honolulu & Waikiki. Professional safe for students. Protect your students!",154,✅ Optimized,"Location + Service: Benefit-driven with location and CTA"
/oahu/showroom-cleaning,src\pages\oahu\showroom-cleaning\+Page.tsx,"Professional showroom cleaning on Oahu. Red Rock Cleans enhances your product presentation with meticulous cleaning for car dealerships, furniture stores, and more in Honolulu and Waikiki.",188,"Showcase products perfectly with Red Rock Cleans' showroom cleaning in Honolulu & Waikiki. Professional meticulous presentation. Impress every visitor!",151,✅ Optimized,"Location + Service: Benefit-driven with location and CTA"
/oahu/standard-cleaning-services,src\pages\oahu\standard-cleaning-services\+Page.tsx,"Keep your home consistently beautiful with our reliable standard cleaning service on Oahu. Red Rock Cleans offers flexible maid services in Honolulu and beyond. Get your free quote!",181,"Maintain a spotless home with Red Rock Cleans' standard cleaning in Honolulu & Waikiki. Professional regular maintenance. Schedule your recurring service!",154,✅ Optimized,"Location + Service: Benefit-driven with location and CTA"
/oahu/warehouse-cleaning,src\pages\oahu\warehouse-cleaning\+Page.tsx,"Professional warehouse cleaning on Oahu. Red Rock Cleans improves safety and efficiency with comprehensive floor scrubbing, high-bay dusting, and more for logistics centers in Honolulu and Kapolei.",197,"Improve safety & efficiency with Red Rock Cleans' warehouse cleaning in Honolulu & Waikiki. Professional floor-to-ceiling service. Get your free estimate!",154,✅ Optimized,"Location + Service: Benefit-driven with location and CTA"
/post-construction,src\pages\PostConstruction.tsx,"Specialized post-construction cleaning to remove dust, debris, and make your newly built or renovated space move-in ready.",122,"Specialized post-construction cleaning to remove dust, debris, and make your newly built or renovated space move-in ready.",122,✅ Already Optimized,"Current description is within optimal range"
/privacy-policy,src\pages\PrivacyPolicy.tsx,"Review the Red Rock Cleans privacy policy. Learn how we collect, use, and protect your personal information when you use our website and services.",146,"Review the Red Rock Cleans privacy policy. Learn how we collect, use, and protect your personal information when you use our website and services.",146,✅ Already Optimized,"Current description is within optimal range"
/residential-cleaning,src\pages\ResidentialCleaning.tsx,"Professional residential cleaning services for your home. From regular maintenance to deep cleaning, we keep your house spotless.",129,"Professional residential cleaning services for your home. From regular maintenance to deep cleaning, we keep your house spotless.",129,✅ Already Optimized,"Current description is within optimal range"
/restaurant-cleaning,src\pages\restaurant-cleaning\+Page.tsx,"Professional restaurant cleaning services. We help you pass health inspections and earn 5-star reviews with comprehensive kitchen and dining room cleaning.",155,"Professional restaurant cleaning services. We help you pass health inspections and earn 5-star reviews with comprehensive kitchen and dining room cleaning.",155,✅ Already Optimized,"Current description is within optimal range"
/salon-spa-cleaning,src\pages\salon-spa-cleaning\+Page.tsx,"Professional salon and spa cleaning services. Red Rock Cleans ensures pristine, hygienic, and relaxing environments for hair salons, day spas, nail salons, and medispas.",169,"Professional salon spa cleaning services by Red Rock Cleans. Trusted experts delivering exceptional results across all locations. Get your free quote today!",156,✅ Optimized,"General service page: Service-specific benefits with CTA"
/school-cleaning,src\pages\school-cleaning\+Page.tsx,"Professional school cleaning services. Red Rock Cleans provides a safe and healthy learning environment for students and staff with our comprehensive janitorial services.",170,"Professional school cleaning services by Red Rock Cleans. Trusted experts delivering exceptional results across all locations. Get your free quote today!",153,✅ Optimized,"General service page: Service-specific benefits with CTA"
/showroom-cleaning,src\pages\showroom-cleaning\+Page.tsx,"Professional showroom cleaning services. Red Rock Cleans enhances your product presentation and client experience with meticulous cleaning for car dealerships, furniture stores, and more.",187,"Professional showroom cleaning services by Red Rock Cleans. Trusted experts delivering exceptional results across all locations. Get your free quote today!",155,✅ Optimized,"General service page: Service-specific benefits with CTA"
/sitemap,src\pages\Sitemap.tsx,"Browse our complete sitemap to find all Red Rock Cleaning pages and services.",77,"Browse Red Rock Cleans' complete sitemap. Find all cleaning services, locations, resources, and pages. Quickly navigate to what you need!",137,✅ Optimized,"Sitemap: Navigation utility"
/south-florida,src\pages\locations\SouthFloridaHome.tsx,"Servicios premium de limpieza residencial y de alquiler vacacional en el sur de Florida, Weston, y Fort Lauderdale. Reserva tu servicio de limpieza profesional hoy.",164,"Premium house cleaning in Fort Lauderdale & Weston by Red Rock Cleans. Residential, commercial, and vacation rental services. Book online today!",144,✅ Optimized,"Location home: City-specific with service types and CTA"
/south-florida-calculator,src\pages\locations\SouthFloridaCalculator.tsx,"Calculate your cleaning service cost instantly. Get an accurate quote for house cleaning in South Florida, Weston, and Fort Lauderdale.",135,"Calculate your cleaning service cost instantly. Get an accurate quote for house cleaning in South Florida, Weston, and Fort Lauderdale.",135,✅ Already Optimized,"Current description is within optimal range"
/south-florida/airbnb-cleaning-services,src\pages\south-florida\airbnb-cleaning-services\+Page.tsx,"Get 5-star reviews with our reliable Airbnb cleaning service in South Florida. Red Rock Cleans offers automated turnover cleaning for vacation rentals in Fort Lauderdale, Weston, and beyond.",190,"Earn 5-star guest reviews with Red Rock Cleans' Airbnb cleaning in Fort Lauderdale & Weston. Professional fast turnover service.",128,✅ Optimized,"Location + Service: Benefit-driven with location and CTA"
/south-florida/church-cleaning,src\pages\south-florida\church-cleaning\+Page.tsx,"Professional church cleaning services in South Florida. Red Rock Cleans provides respectful, detailed cleaning for places of worship in Fort Lauderdale, Weston, and across the region.",183,"Keep your place of worship pristine with Red Rock Cleans' church cleaning in Fort Lauderdale & Weston. Professional respectful, detailed service.",145,✅ Optimized,"Location + Service: Benefit-driven with location and CTA"
/south-florida/data-center-cleaning,src\pages\south-florida\data-center-cleaning\+Page.tsx,"Specialized data center cleaning in South Florida. Red Rock Cleans offers ISO 14644-1 compliant server room, sub-floor, and critical environment cleaning in Fort Lauderdale and Weston to ensure uptime.",201,"Protect your critical infrastructure with Red Rock Cleans' data center cleaning in Fort Lauderdale & Weston. Professional ISO-compliant cleanroom service.",154,✅ Optimized,"Location + Service: Benefit-driven with location and CTA"
/south-florida/deep-cleaning-services,src\pages\south-florida\deep-cleaning-services\+Page.tsx,"Restore your home's sparkle with our thorough deep cleaning service in South Florida. We tackle built-up grime for a truly refreshed home in Fort Lauderdale, Weston, and beyond.",177,"Get a truly deep clean with Red Rock Cleans' deep cleaning in Fort Lauderdale & Weston. Professional top-to-bottom scrubbing. Book your deep clean today!",153,✅ Optimized,"Location + Service: Benefit-driven with location and CTA"
/south-florida/factory-cleaning,src\pages\south-florida\factory-cleaning\+Page.tsx,"Professional factory cleaning in South Florida. Red Rock Cleans offers heavy-duty cleaning for manufacturing plants in Fort Lauderdale, Weston, and beyond to ensure safety and productivity.",189,"Keep your facility safe & productive with Red Rock Cleans' factory cleaning in Fort Lauderdale & Weston. Professional heavy-duty industrial service.",148,✅ Optimized,"Location + Service: Benefit-driven with location and CTA"
/south-florida/government-facility-cleaning,src\pages\south-florida\government-facility-cleaning\+Page.tsx,"Secure and compliant government facility cleaning in South Florida. Red Rock Cleans provides discreet, professional cleaning for municipal and federal buildings in Fort Lauderdale and Weston by security-cleared staff.",217,"Maintain secure facilities with Red Rock Cleans' government cleaning in Fort Lauderdale & Weston. Professional security-cleared staff.",134,✅ Optimized,"Location + Service: Benefit-driven with location and CTA"
/south-florida/gym-cleaning,src\pages\south-florida\gym-cleaning\+Page.tsx,"Professional gym cleaning in South Florida. Red Rock Cleans provides hygienic fitness center and health club sanitation, including equipment disinfection and locker room cleaning in Fort Lauderdale and Weston.",209,"Keep members healthy & happy with Red Rock Cleans' gym cleaning in Fort Lauderdale & Weston. Professional equipment disinfection. Boost member retention!",153,✅ Optimized,"Location + Service: Benefit-driven with location and CTA"
/south-florida/industrial-cleaning,src\pages\south-florida\industrial-cleaning\+Page.tsx,"Heavy-duty industrial cleaning services in South Florida. Red Rock Cleans provides OSHA compliant cleaning for manufacturing plants and industrial facilities in Fort Lauderdale and beyond.",188,"Maintain OSHA compliance with Red Rock Cleans' industrial cleaning in Fort Lauderdale & Weston. Professional heavy-duty solutions. Schedule your service!",153,✅ Optimized,"Location + Service: Benefit-driven with location and CTA"
/south-florida/medical-office-cleaning,src\pages\south-florida\medical-office-cleaning\+Page.tsx,"Specialized medical office cleaning in South Florida. Red Rock Cleans provides HIPAA and OSHA compliant cleaning for clinics and healthcare facilities in Fort Lauderdale, Weston, and beyond.",190,"Ensure patient safety with Red Rock Cleans' medical office cleaning in Fort Lauderdale & Weston. Professional HIPAA-compliant service. Protect your patients!",157,✅ Optimized,"Location + Service: Benefit-driven with location and CTA"
